<?xml version="1.0" encoding="UTF-8"?>
<CodeLists xmlns="http://xml.insee.fr/schema/applis/pogues"
    xmlns:xsi="http://www.w3.org/2001/XMLSchema-instance"
    xsi:schemaLocation="http://xml.insee.fr/schema/applis/pogues file:/src/main/resources/xsd/Questionnaire.xsd">
	<CodeList id="isg1g6zo">
		<Name />
		<Label>LISTE_TEST</Label>
		<Code>
			<Value />
			<Label>choix 1</Label>
		</Code>
		<Code>
			<Value />
			<Label>choix 2</Label>
		</Code>
		<Code>
			<Value />
			<Label>choix 3</Label>
		</Code>
		<Code>
			<Value />
			<Label>choix 4</Label>
		</Code>
		<Code>
			<Value />
			<Label>choix 5</Label>
		</Code>
	</CodeList>
	<CodeList id="isg1uorv">
		<Name />
		<Label>Oui_Non</Label>
		<Code>
			<Value />
			<Label>Oui</Label>
		</Code>
		<Code>
			<Value />
			<Label>Non</Label>
		</Code>
	</CodeList>
	<CodeList id="isg27fpv">
		<Name />
		<Label>LISTE_TEST_2</Label>
		<Code>
			<Value />
			<Label>choix 6</Label>
		</Code>
		<Code>
			<Value />
			<Label>choix 7</Label>
		</Code>
		<Code>
			<Value />
			<Label>choix 8</Label>
		</Code>
		<Code>
			<Value />
			<Label>choix 9</Label>
		</Code>
	</CodeList>
	<CodeList id="iw22dla9">
		<Name />
		<Label>DOMAINE</Label>
		<Code>
			<Value />
			<Label>Eaux usées</Label>
		</Code>
		<Code>
			<Value />
			<Label>Déchets hors radioactifs</Label>
		</Code>
		<Code>
			<Value />
			<Label>Protection de l’air</Label>
		</Code>
		<Code>
			<Value />
			<Label>Limitation des émissions de gaz à effet de serre</Label>
		</Code>
		<Code>
			<Value />
			<Label>Bruits et vibrations</Label>
		</Code>
		<Code>
			<Value />
			<Label>Sols, eaux souterraines et de surface</Label>
		</Code>
		<Code>
			<Value />
			<Label>Sites, paysages et biodiversité</Label>
		</Code>
		<Code>
			<Value />
			<Label>Autres (rayonnement, R&amp;D sur l’environnement…)</Label>
		</Code>
	</CodeList>
	<CodeList id="iw22fswu">
		<Name />
		<Label>L_SEXE</Label>
		<Code>
			<Value />
			<Label>Masculin</Label>
		</Code>
		<Code>
			<Value />
			<Label>Féminin</Label>
		</Code>
	</CodeList>

</CodeLists>
 
